{"api_version":"forgeos.work-intent/v1","attestations":{"approval_attestation":false,"authentication_attestation":false,"authority_attestation":false,"completion_attestation":false,"effect_attestation":false,"execution_attestation":false,"freshness_attestation":false,"materiality_attestation":false,"ownership_attestation":false,"permission_attestation":false,"persistence_attestation":false,"reference_resolution_attestation":false,"scope_attestation":false,"truth_attestation":false},"binding":{"change_id":"change-work-intent-1","project_id":"forgeos","run_id":null},"canonicalization":"forgeos.canonical-json/v1","declared_at_unix_ms":1700000000000,"declared_owner":{"authority_domain":"forgeos.fixture","principal_id":"owner-work-intent-1","principal_type":"human"},"freshness":"not_evaluated","intent":{"deadline_unix_ms":1699999999000,"external_constraints":["Preserve the public compatibility surface."],"goal":"Publish an authority-neutral WorkIntent v1 candidate contract.","non_goals":["Do not authorize execution or effects."],"open_questions":["Which authenticated route may later consume it?"],"scope":["The lexical WorkIntent declaration and self-digest."],"success_signals":["Python rejects every non-canonical instance."],"work_type":"architecture_evolution"},"kind":"WorkIntent","materiality":{"basis":"caller_declaration_only","level":"L2"},"origin":{"origin_kind":"user_request","origin_ref":"request/work-intent-v1"},"references":{"claim_record_refs":[{"canonical_sha256":"1111111111111111111111111111111111111111111111111111111111111111","record_id":"claim-work-intent-contract"}],"evidence_record_refs":[{"canonical_sha256":"2222222222222222222222222222222222222222222222222222222222222222","record_id":"evidence-work-intent-review"}],"local_artifact_declarations":[{"artifact_kind":"json-schema","artifact_ref":"docs/contracts/work-intent-v1.schema.json","artifact_sha256":"3333333333333333333333333333333333333333333333333333333333333333"}],"local_source_snapshot_declaration":{"snapshot_id":"repository:work-intent-v1-candidate","snapshot_sha256":"4444444444444444444444444444444444444444444444444444444444444444","snapshot_type":"repository"}},"requester":{"authority_domain":"forgeos.fixture","principal_id":"requester-work-intent-1","principal_type":"agent"},"status":"declared_unassessed","work_intent_id":"work-intent-2fe0424d30405a8b1d716afc99bbd38d602375f3316fd1c54c472890d520a225","work_intent_sha256":"2fe0424d30405a8b1d716afc99bbd38d602375f3316fd1c54c472890d520a225"}
